{
  "$schema": "http://json-schema.org/draft-07/schema#",
  "$id": "https://firstmate/unattended-crew/task-contract.schema.json",
  "title": "Unattended batch task contract",
  "description": "The durable work contract the batch coordinator loads. One batch has an ordered list of tasks; the coordinator never invents work outside this list and never performs an operation listed in forbidden_operations.",
  "type": "object",
  "required": ["batch_id", "baseline_sha", "mode", "tasks"],
  "additionalProperties": false,
  "properties": {
    "batch_id": { "type": "string", "minLength": 1 },
    "baseline_sha": {
      "type": "string",
      "description": "The git SHA every task's evidence is measured against. Recorded in every state transition and in the evidence git-before/after."
    },
    "mode": {
      "enum": ["test", "production"],
      "description": "test admits the fake auditor; production refuses VERIFIED_PASS from a fake auditor."
    },
    "patch_sha256": {
      "type": "string",
      "description": "Optional expected hash of the change under validation; a mismatch between this and executor/patch-hash is a HOLD."
    },
    "allowed_paths": { "type": "array", "items": { "type": "string" } },
    "forbidden_operations": {
      "type": "array",
      "items": {
        "enum": ["github_write", "credential_change", "home_checkout_change", "watcher_runtime_change", "real_worker_call", "wake_drain", "backpass_change", "kill_other_session_process", "external_write"]
      }
    },
    "retry_limit": { "type": "integer", "minimum": 1, "default": 2, "description": "Maximum dispatch attempts per task before HOLD (retry-exhausted)." },
    "ack_timeout_secs": { "type": "integer", "minimum": 1, "default": 5 },
    "tasks": {
      "type": "array",
      "minItems": 1,
      "items": {
        "type": "object",
        "required": ["task_id", "executor"],
        "additionalProperties": false,
        "properties": {
          "task_id": { "type": "string", "minLength": 1 },
          "depends_on": { "type": "array", "items": { "type": "string" }, "description": "Task ids that must reach VERIFIED_PASS before this task is dispatched." },
          "approval_required": { "type": "boolean", "default": false, "description": "When true the task is held for the captain instead of dispatched." },
          "required_tests": { "type": "array", "items": { "type": "string" }, "description": "Named tests the executor command must run; fewer executed entries than this length is a HOLD." },
          "patch_sha256": { "type": "string" },
          "executor": {
            "type": "object",
            "required": ["command"],
            "additionalProperties": false,
            "properties": {
              "command": { "type": "array", "items": { "type": "string" }, "minItems": 1 },
              "intent": { "type": "string", "description": "Real-backend executor mission: the captain's-intent text the coordinator scaffolds into data/<id>/brief.md before a real scout spawn." },
              "spec": { "type": "string", "description": "Real-backend executor spec text filled into the brief's Firstmate spec section." },
              "claims": {
                "type": "array",
                "description": "Executor Evidence Guard claims. Before the auditor is dispatched, each claimed value in the executor report is compared against a machine-derived canonical value (read-only); any mismatch holds the task with reason evidence-guard-mismatch. An empty or absent list is a no-op pass.",
                "items": {
                  "type": "object",
                  "required": ["id", "kind"],
                  "additionalProperties": false,
                  "properties": {
                    "id": { "type": "string", "minLength": 1, "description": "Stable claim name, also the default StructClaim key." },
                    "kind": { "enum": ["count", "set"], "description": "count compares one number; set compares an order-insensitive file/item list." },
                    "report_pattern": { "type": "string", "description": "Optional ERE whose first capture group is the value the report asserts. Default for count is the structured line 'StructClaim: <id> = <n>'." },
                    "required": { "type": "boolean", "default": true, "description": "When true, a claim the report never asserts is a mismatch (fail-closed)." },
                    "source": {
                      "type": "object",
                      "required": ["type", "reduce"],
                      "additionalProperties": false,
                      "properties": {
                        "type": { "enum": ["cmd", "report"], "description": "cmd derives the canonical value from a command run in the executor worktree; report derives it from the report text itself (self-contradiction detection)." },
                        "cmd": { "type": "string", "description": "For source.type=cmd: the read-only command whose stdout is reduced. Required when type=cmd." },
                        "reduce": { "type": "string", "description": "lines (non-empty stripped lines list; len = count) or count_re:<ERE> (number of matching lines)." }
                      }
                    }
                  }
                }
              }
            }
          },
          "audit": {
            "type": "object",
            "additionalProperties": false,
            "properties": {
              "required": { "type": "boolean", "default": true },
              "command": { "type": "array", "items": { "type": "string" }, "description": "Optional real auditor command; absent uses the built-in fake auditor (mode=test only)." },
              "auditor_kind": { "enum": ["fake", "real"] },
              "intent": { "type": "string", "description": "Real-backend auditor mission intent for the separate audit brief." },
              "spec": { "type": "string", "description": "Real-backend auditor mission spec for the separate audit brief." }
            }
          }
        }
      }
    }
  }
}
